{
  "format": "ccf.downgrade-receipt/0.2.0",
  "receipt_id": "urn:ccf:receipt:13131313-1313-4313-8313-131313131313",
  "export_pack_id": "urn:ccf:pack:cccccccc-cccc-4ccc-8ccc-cccccccccccc",
  "source_level": "ccf-verified-archive-v1",
  "target_level": "ccf-exchange-v1",
  "created_at": "2026-08-24T12:05:00.000Z",
  "losslessness": "lossy",
  "omissions": [
    {
      "category": "journal_proof",
      "subject": "source archive commit and membership streams",
      "reason": "The Exchange recipient requested submissions only."
    }
  ],
  "preserved_opaque": [
    {
      "path": "opaque/source-custody-proofs.zip",
      "digest": "sha256:6666666666666666666666666666666666666666666666666666666666666666",
      "reason": "The recipient cannot interpret Verified Archive proofs but can retain them byte-for-byte."
    }
  ],
  "extensions": {}
}
